<?xml version="1.0" encoding="UTF-8"?>
<xs:schema xmlns:xs="http://www.w3.org/2001/XMLSchema">
  <xs:element name="project">
    <xs:complexType>
      <xs:sequence>
        <xs:element type="xs:string" name="name"/>
        <xs:element type="xs:string" name="description"/>
        <xs:element name="members">
          <xs:complexType>
            <xs:sequence>
              <xs:element name="member" maxOccurs="unbounded" minOccurs="0">
                <xs:complexType>
                  <xs:sequence>
                    <xs:element type="xs:string" name="name"/>
                    <xs:element type="xs:string" name="degree"/>
                    <xs:element type="xs:string" name="university"/>
                  </xs:sequence>
                </xs:complexType>
              </xs:element>
            </xs:sequence>
          </xs:complexType>
        </xs:element>
      </xs:sequence>
    </xs:complexType>
  </xs:element>
</xs:schema>